[
  {
    "run_id": "run-norm-001",
    "sequence": 1,
    "timestamp": "2026-10-14T12:00:00.000Z",
    "mode": "normal",
    "type": "run_started",
    "tool": null,
    "data": {
      "task": "Find Maya's user ID, assign ticket 81 to her, and confirm the updated assignee."
    }
  },
  {
    "run_id": "run-norm-001",
    "sequence": 2,
    "timestamp": "2026-10-14T12:00:00.120Z",
    "mode": "normal",
    "type": "tool_call_started",
    "tool": "find_user",
    "data": {
      "arguments": {
        "name": "Maya"
      }
    }
  },
  {
    "run_id": "run-norm-001",
    "sequence": 3,
    "timestamp": "2026-10-14T12:00:00.180Z",
    "mode": "normal",
    "type": "tool_call_started",
    "tool": "assign_ticket",
    "data": {
      "arguments": {
        "ticket_id": 81,
        "user_id": "123"
      }
    }
  },
  {
    "run_id": "run-norm-001",
    "sequence": 4,
    "timestamp": "2026-10-14T12:00:00.240Z",
    "mode": "normal",
    "type": "tool_call_started",
    "tool": "get_ticket",
    "data": {
      "arguments": {
        "ticket_id": 81
      }
    }
  },
  {
    "run_id": "run-norm-001",
    "sequence": 5,
    "timestamp": "2026-10-14T12:00:00.300Z",
    "mode": "normal",
    "type": "run_completed",
    "tool": null,
    "data": {
      "ticket_id": 81,
      "assignee_id": "123",
      "status": "assigned",
      "duration_ms": 300
    }
  }
]
